{
  "schema_version": "1.0.0",
  "task_id": "task_01J00000000000000000000000",
  "compiler": {"solc_version":"0.8.26","evm_version":"cancun","optimizer_enabled":true,"optimizer_runs":200,"via_ir":false,"foundry_profile":"v1"},
  "task": {
    "title":"Implement a synthetic access-controlled token",
    "summary":"Synthetic fixture only",
    "requirements":[{"id":"R1","text":"Only MINTER_ROLE may mint","kind":"authorization","priority":"must"}],
    "interfaces":[{"artifact_id":"required-interface","contract":"IExample","required_signatures":["mint(address,uint256)"]}],
    "invariants":[{"id":"I1","text":"Total supply equals aggregate balances","check":"hidden-test:invariant_totalSupply"}],
    "constraints":{"allowed_dependencies":["forge-std@1.9.4"],"forbidden_operations":["selfdestruct","delegatecall"],"allowed_output_paths":["src/Example.sol","test/ExampleCandidate.t.sol"],"required_target_paths":["src/Example.sol"],"max_output_bytes":100000}
  },
  "required_source_files":[{"artifact_id":"required-interface","path":"src/interfaces/IExample.sol","role":"interface","content":"// SPDX-License-Identifier: MIT\npragma solidity 0.8.26;\ninterface IExample { function mint(address to, uint256 amount) external; }\n","content_sha256":"b08b5f61d701aa814116abe2ba96ee00cc2c694ba948c2267b1f79995bbaa660"}],
  "reference_context":[{"artifact_id":"reference-access-control","path":"src/reference/AccessPattern.sol","line_range":{"start":1,"end":3},"purpose":"synthetic access-control convention","content":"// SPDX-License-Identifier: MIT\npragma solidity 0.8.26;\nabstract contract AccessPattern {}\n","content_sha256":"936f8f2df10ea0a5ac9b7e91a1558292a1b40a65c2dfcc212950fde646ca7476"}],
  "public_tests":[{"artifact_id":"public-interface-test","path":"test/public/ExampleInterface.t.sol","content":"// synthetic public interface test\n","content_sha256":"be3caca34a537f8169e8df14d7b52224803a0ea252d7480b1d315159c01305a6"}]
}
